{
  "record_id": "isaac-2026-cuo-xas-0001",
  "schema_version": "0.1.0-provisional",
  "sample": {
    "name": {
      "value": "CuO reference powder",
      "status": "verified",
      "evidence": [
        {
          "source_type": "web_form",
          "source_file": "examples/webform_sample_details.png",
          "locator": "Sample details → Sample name",
          "quote": "CuO reference powder"
        }
      ]
    },
    "formula": {
      "value": "CuO",
      "status": "verified",
      "evidence": [
        {
          "source_type": "web_form",
          "source_file": "examples/webform_sample_details.png",
          "locator": "Details section → Chemical formula",
          "quote": "CuO"
        }
      ]
    },
    "physical_form": {
      "value": "powder",
      "status": "verified",
      "evidence": [
        {
          "source_type": "web_form",
          "source_file": "examples/webform_sample_details.png",
          "locator": "Details section → Physical form (dropdown)",
          "quote": "powder"
        }
      ]
    }
  },
  "technique": {
    "name": {
      "value": "XAS",
      "status": "verified",
      "evidence": [
        {
          "source_type": "screenshot",
          "source_file": "examples/webform_session.png",
          "locator": "Session title bar",
          "quote": "XAS/EXAFS — BL15-2"
        }
      ]
    },
    "xas": {
      "absorbing_element": {
        "value": "Cu",
        "status": "verified",
        "evidence": [
          {
            "source_type": "user_confirmation",
            "question": "What absorbing element was measured?",
            "answer": "Cu",
            "timestamp": "2026-07-04T10:00:00Z"
          }
        ]
      },
      "edge": {
        "value": "K",
        "status": "verified",
        "evidence": [
          {
            "source_type": "user_confirmation",
            "question": "Which edge was used?",
            "answer": "K",
            "timestamp": "2026-07-04T10:00:30Z"
          }
        ]
      },
      "detection_mode": {
        "value": "transmission",
        "status": "verified",
        "evidence": [
          {
            "source_type": "user_confirmation",
            "question": "What detection mode was used?",
            "answer": "transmission",
            "timestamp": "2026-07-04T10:01:00Z"
          }
        ]
      }
    }
  },
  "instrument": {
    "facility": {
      "value": "SSRL",
      "status": "verified",
      "evidence": [
        {
          "source_type": "spreadsheet",
          "source_file": "examples/campaign_metadata.xlsx",
          "locator": "Sheet 'Campaign Info', cell B2",
          "quote": "SSRL"
        }
      ]
    },
    "beamline": {
      "value": "BL15-2",
      "status": "verified",
      "evidence": [
        {
          "source_type": "screenshot",
          "source_file": "examples/webform_session.png",
          "locator": "Session title bar",
          "quote": "XAS/EXAFS — BL15-2"
        }
      ]
    }
  },
  "conditions": {
    "environment": {
      "value": "operando",
      "status": "verified",
      "evidence": [
        {
          "source_type": "web_form",
          "source_file": "examples/webform_conditions.png",
          "locator": "Environment (dropdown)",
          "quote": "operando"
        }
      ]
    },
    "temperature": {
      "value": 523,
      "unit": "kelvin",
      "status": "verified",
      "evidence": [
        {
          "source_type": "spreadsheet",
          "source_file": "examples/campaign_metadata.xlsx",
          "locator": "Sheet 'Configurations', cell D14",
          "quote": "523 K"
        }
      ]
    }
  },
  "raw_data": {
    "uris": {
      "value": ["file:///ssrl/bl15-2/2026/prod-check-CuO/"],
      "status": "verified",
      "evidence": [
        {
          "source_type": "user_confirmation",
          "question": "Where are the raw scan files stored?",
          "answer": "file:///ssrl/bl15-2/2026/prod-check-CuO/",
          "timestamp": "2026-07-04T10:02:00Z"
        }
      ]
    },
    "filename_pattern": {
      "value": "prod-check-CuO",
      "status": "verified",
      "evidence": [
        {
          "source_type": "web_form",
          "source_file": "examples/webform_session.png",
          "locator": "Filename pattern field",
          "quote": "prod-check-CuO"
        }
      ]
    }
  },
  "provenance": {
    "created_by": "krish.verma2808@gmail.com",
    "created_at": "2026-07-04T10:05:00Z",
    "source_files": [
      "examples/campaign_metadata.xlsx",
      "examples/webform_sample_details.png",
      "examples/webform_session.png",
      "examples/webform_conditions.png"
    ]
  }
}
